{
  "id": "aeroplan",
  "name": "Aeroplan",
  "type": "airline",
  "alliance": "star",
  "redeemableCurrency": "Aeroplan points",
  "metrics": [
    {
      "id": "sqc",
      "name": "Status Qualifying Credits",
      "unit": "SQC",
      "periodType": "calendarYear"
    }
  ],
  "tiers": [
    {
      "id": "25k",
      "name": "Aeroplan 25K",
      "rank": 1,
      "mode": "anyOf",
      "allianceStatus": "silver",
      "thresholds": [
        {
          "metricId": "sqc",
          "value": 25000
        }
      ]
    },
    {
      "id": "35k",
      "name": "Aeroplan 35K",
      "rank": 2,
      "mode": "anyOf",
      "allianceStatus": "gold",
      "thresholds": [
        {
          "metricId": "sqc",
          "value": 35000
        }
      ]
    },
    {
      "id": "50k",
      "name": "Aeroplan 50K",
      "rank": 3,
      "mode": "anyOf",
      "allianceStatus": "gold",
      "thresholds": [
        {
          "metricId": "sqc",
          "value": 50000
        }
      ]
    },
    {
      "id": "75k",
      "name": "Aeroplan 75K",
      "rank": 4,
      "mode": "anyOf",
      "allianceStatus": "gold",
      "thresholds": [
        {
          "metricId": "sqc",
          "value": 75000
        }
      ]
    },
    {
      "id": "super-elite",
      "name": "Aeroplan Super Elite",
      "rank": 5,
      "mode": "anyOf",
      "allianceStatus": "gold",
      "thresholds": [
        {
          "metricId": "sqc",
          "value": 125000
        }
      ]
    }
  ],
  "carriers": [
    "AC"
  ]
}
